{
  "id": "T022",
  "family": "debug_repair",
  "difficulty": "medium",
  "specification": "Compactador de array removendo falsy values (false, null, 0, \"\", undefined, NaN) exceto zero se configurado. Entrada: array. Saída: array filtrado sem null/undefined/\"\".",
  "allowed_effects": [],
  "forbidden_effects": [
    "globalState"
  ],
  "test_cases": [
    {
      "input": [
        0,
        1,
        false,
        2,
        "",
        3,
        null,
        null
      ],
      "expected": [
        0,
        1,
        2,
        3
      ]
    }
  ],
  "oracle": {
    "type": "deterministic_unit",
    "entrypoint": "oracles/oracle_T022.mjs"
  }
}